<?xml version="1.0" encoding="UTF-8" ?>
<xs:schema xmlns:xs="http://www.w3.org/2001/XMLSchema" xmlns="http://www.productos.es" targetNamespace="http://www.productos.es" elementFormDefault="qualified">
    <xs:element name="productos">
        <xs:complexType>
            <xs:sequence>
                <xs:element name="producto" maxOccurs="unbounded">
                    <xs:complexType>
                        <xs:sequence>
                            <xs:element name="nombre" type="xs:string" />
                            <xs:element name="precio" type="xs:decimal" />
                            <xs:element name="procedencia">
                                <xs:complexType>
                                    <xs:sequence>
                                        <xs:element name="provincia" type="xs:string" maxOccurs="unbounded" />
                                    </xs:sequence>
                                </xs:complexType>
                            </xs:element>
                        </xs:sequence>
                        <xs:attribute name="idProducto" type="xs:integer" />
                    </xs:complexType>
                </xs:element>
            </xs:sequence>
        </xs:complexType>
    </xs:element>
</xs:schema>